{
 "$schema": "https://json-schema.org/draft/2020-12/schema",
 "$id": "https://zenjax7.github.io/chinese-rpg/schemas/world/graph.schema.json",
 "title": "World graph (graph/0.3): one file per world map, realm overworld or dungeon level",
 "type": "object",
 "properties": {
  "_note": {
   "type": "string"
  },
  "schema": {
   "const": "graph/0.3"
  },
  "id": {
   "type": "string",
   "pattern": "^[a-z0-9_]+$"
  },
  "kind": {
   "enum": [
    "world",
    "overworld",
    "dungeon_level"
   ]
  },
  "realm": {
   "type": [
    "integer",
    "null"
   ],
   "minimum": 1,
   "maximum": 9
  },
  "dungeon": {
   "type": [
    "string",
    "null"
   ]
  },
  "level": {
   "type": "integer",
   "minimum": 0
  },
  "levels": {
   "type": "integer",
   "minimum": 1
  },
  "optional": {
   "type": "boolean"
  },
  "title": {
   "type": "object",
   "properties": {
    "zh": {
     "type": "string"
    },
    "en": {
     "type": "string"
    }
   },
   "required": [
    "en"
   ],
   "additionalProperties": false
  },
  "status": {
   "enum": [
    "authored",
    "reference"
   ]
  },
  "entry": {
   "type": "string",
   "pattern": "^[a-z0-9_]+$"
  },
  "idxMax": {
   "type": "integer",
   "minimum": 0
  },
  "edgeIdxMax": {
   "type": "integer",
   "minimum": -1
  },
  "aspect": {
   "type": "number",
   "exclusiveMinimum": 0,
   "description": "width/height of the layout box (x/y are normalised separately)"
  },
  "background": {
   "type": "object",
   "properties": {
    "map": {
     "type": "string"
    },
    "battle": {
     "type": "string"
    }
   }
  },
  "music": {
   "type": "string"
  },
  "nodes": {
   "type": "array",
   "items": {
    "type": "object",
    "properties": {
     "id": {
      "type": "string",
      "pattern": "^[a-z0-9_]+$"
     },
     "idx": {
      "type": "integer",
      "minimum": 0,
      "description": "stable, never reused (save bitsets)"
     },
     "kind": {
      "enum": [
       "town",
       "village",
       "inn",
       "waypoint",
       "fork",
       "chest",
       "npc",
       "story",
       "miniboss",
       "boss",
       "lever",
       "stairs_up",
       "stairs_down",
       "portal",
       "exit",
       "shop"
      ]
     },
     "x": {
      "type": "number",
      "minimum": 0,
      "maximum": 1,
      "description": "normalised 0-1 across the graph (v3.9); multiply by the map width"
     },
     "y": {
      "type": "number",
      "minimum": 0,
      "maximum": 1,
      "description": "normalised 0-1, 0 = top"
     },
     "fog": {
      "enum": [
       "normal",
       "landmark",
       "secret"
      ],
      "description": "default normal: shown as ? once a neighbour is visited; landmark: shown once the graph is open; secret: never shown as ?"
     },
     "zone": {
      "type": "string",
      "pattern": "^[a-z0-9_]+$"
     },
     "title": {
      "type": "object",
      "properties": {
       "zh": {
        "type": "string"
       },
       "en": {
        "type": "string"
       }
      },
      "required": [
       "en"
      ],
      "additionalProperties": false
     },
     "save": {
      "type": "boolean"
     },
     "services": {
      "type": "array",
      "items": {
       "enum": [
        "inn",
        "save",
        "shop",
        "potions",
        "magic",
        "school",
        "practice",
        "board",
        "smith"
       ]
      }
     },
     "hub": {
      "type": "string",
      "description": "town screen id (screens.ts)"
     },
     "town": {
      "type": "integer",
      "minimum": 1,
      "maximum": 9,
      "description": "towns.json number (prices)"
     },
     "shops": {
      "type": "array",
      "items": {
       "type": "string"
      }
     },
     "campfire": {
      "type": "boolean"
     },
     "boss": {
      "type": "string",
      "description": "zone id"
     },
     "npc": {
      "type": "string",
      "pattern": "^[a-z0-9_]+$"
     },
     "inBuild": {
      "type": "boolean"
     }
    },
    "required": [
     "id",
     "idx",
     "kind",
     "x",
     "y"
    ],
    "additionalProperties": false
   },
   "minItems": 1
  },
  "edges": {
   "type": "array",
   "items": {
    "type": "object",
    "properties": {
     "id": {
      "type": "string",
      "pattern": "^[a-z0-9_]+$"
     },
     "idx": {
      "type": "integer",
      "minimum": 0,
      "description": "stable, never reused (progress bitsets)"
     },
     "from": {
      "type": "string",
      "pattern": "^[a-z0-9_]+$"
     },
     "to": {
      "oneOf": [
       {
        "type": "string",
        "pattern": "^[a-z0-9_]+$"
       },
       {
        "$ref": "common.schema.json#/$defs/nodeRef"
       }
      ]
     },
     "kind": {
      "enum": [
       "path",
       "oneway",
       "shortcut",
       "stairs",
       "portal",
       "exit"
      ]
     },
     "danger": {
      "type": "integer",
      "minimum": 0,
      "maximum": 3
     },
     "steps": {
      "type": "integer",
      "minimum": 1,
      "maximum": 8
     },
     "terrain": {
      "type": "string"
     },
     "patrol": {
      "type": "boolean",
      "description": "boss approach: no random battles; Train/patrol rule applies (spec §7.4)"
     },
     "scripted": {
      "type": "object",
      "properties": {
       "enemies": {
        "type": "array",
        "items": {
         "type": "string",
         "pattern": "^[a-z0-9_]+$"
        }
       },
       "fill": {
        "type": "boolean"
       },
       "once": {
        "type": "boolean"
       },
       "step": {
        "type": "integer",
        "minimum": 1
       }
      },
      "required": [
       "enemies"
      ],
      "additionalProperties": false
     },
     "cond": {
      "$ref": "common.schema.json#/$defs/cond"
     },
     "opens": {
      "type": "string",
      "description": "shortcut id this edge belongs to"
     },
     "label": {
      "type": "object",
      "properties": {
       "zh": {
        "type": "string"
       },
       "en": {
        "type": "string"
       }
      },
      "required": [
       "en"
      ],
      "additionalProperties": false
     },
     "note": {
      "type": "string"
     }
    },
    "required": [
     "id",
     "idx",
     "from",
     "to",
     "kind"
    ],
    "additionalProperties": false,
    "allOf": [
     {
      "if": {
       "properties": {
        "kind": {
         "enum": [
          "stairs",
          "portal",
          "exit"
         ]
        }
       }
      },
      "then": {
       "properties": {
        "to": {
         "$ref": "common.schema.json#/$defs/nodeRef"
        }
       }
      },
      "else": {
       "properties": {
        "to": {
         "type": "string",
         "pattern": "^[a-z0-9_]+$"
        }
       },
       "required": [
        "danger",
        "steps"
       ]
      }
     }
    ]
   }
  },
  "events": {
   "type": "array",
   "items": {
    "type": "object",
    "properties": {
     "id": {
      "type": "string"
     },
     "node": {
      "type": "string",
      "pattern": "^[a-z0-9_]+$"
     },
     "on": {
      "enum": [
       "enter",
       "firstEnter",
       "clear",
       "leave",
       "rest"
      ]
     },
     "tutorial": {
      "type": "boolean"
     },
     "outcome": {
      "$ref": "common.schema.json#/$defs/outcome"
     },
     "once": {
      "type": "boolean"
     },
     "cooldown": {
      "type": "integer",
      "minimum": 1,
      "description": "visits to this node before it can fire again"
     },
     "cond": {
      "$ref": "common.schema.json#/$defs/cond"
     },
     "do": {
      "type": "array",
      "items": {
       "$ref": "common.schema.json#/$defs/action"
      }
     },
     "pick": {
      "type": "array",
      "minItems": 1,
      "items": {
       "type": "object",
       "properties": {
        "weight": {
         "type": "number",
         "exclusiveMinimum": 0
        },
        "outcome": {
         "$ref": "common.schema.json#/$defs/outcome"
        },
        "once": {
         "type": "boolean"
        },
        "cooldown": {
         "type": "integer",
         "minimum": 1,
         "description": "visits to this node before it can fire again"
        },
        "cond": {
         "$ref": "common.schema.json#/$defs/cond"
        },
        "do": {
         "type": "array",
         "items": {
          "$ref": "common.schema.json#/$defs/action"
         }
        }
       },
       "required": [
        "weight",
        "do"
       ],
       "additionalProperties": false
      }
     }
    },
    "required": [
     "id",
     "node",
     "on"
    ],
    "oneOf": [
     {
      "required": [
       "do"
      ],
      "not": {
       "required": [
        "pick"
       ]
      }
     },
     {
      "required": [
       "pick"
      ],
      "not": {
       "required": [
        "do"
       ]
      }
     }
    ],
    "additionalProperties": false
   }
  },
  "dialogue": {
   "type": "object",
   "additionalProperties": {
    "type": "array",
    "items": {
     "type": "object",
     "description": "v3.9: en may hold {Cxxx} word-token placeholders (core-curriculum ids) listed in tokens, as in data/dialogue scenes; zh optional. Realm 1 follows density D1 (validator).",
     "properties": {
      "speaker": {
       "type": "string",
       "pattern": "^[a-z0-9_]+$"
      },
      "zh": {
       "type": "string"
      },
      "en": {
       "type": "string"
      },
      "tokens": {
       "type": "array",
       "items": {
        "type": "string",
        "pattern": "^C[0-9]{3}$"
       }
      },
      "vo": {
       "type": "string"
      }
     },
     "required": [
      "speaker",
      "en"
     ],
     "additionalProperties": false
    },
    "minItems": 1
   }
  },
  "npcs": {
   "type": "object",
   "additionalProperties": {
    "type": "object",
    "properties": {
     "name": {
      "type": "object",
      "properties": {
       "zh": {
        "type": "string"
       },
       "en": {
        "type": "string"
       }
      },
      "required": [
       "en"
      ],
      "additionalProperties": false
     },
     "portrait": {
      "type": "string"
     }
    },
    "required": [
     "name"
    ]
   }
  },
  "realms": {
   "type": "array",
   "minItems": 9,
   "maxItems": 9,
   "description": "v3.9.2, world graph only: one link per realm. Realm N+1 unlocks when realm N's realm-boss zone is cleared.",
   "items": {
    "type": "object",
    "properties": {
     "realm": {
      "type": "integer",
      "minimum": 1,
      "maximum": 9
     },
     "node": {
      "type": "string",
      "pattern": "^[a-z0-9_]+$"
     },
     "graph": {
      "type": "string",
      "pattern": "^[a-z0-9_]+$"
     },
     "entry": {
      "type": "string",
      "pattern": "^[a-z0-9_]+$"
     },
     "enterEdge": {
      "type": "string",
      "description": "world edge (portal) from the realm node into the realm graph's entry node"
     },
     "exitEdge": {
      "type": "string",
      "description": "edge id in the realm graph: entry town/village -> this world node (kind exit, no battles)"
     },
     "linkEdge": {
      "type": [
       "string",
       "null"
      ],
      "description": "world edge from the previous realm node to this one (null for realm 1)"
     },
     "unlock": {
      "oneOf": [
       {
        "type": "null"
       },
       {
        "type": "object",
        "properties": {
         "bossDefeated": {
          "type": "string",
          "pattern": "^[a-z0-9_]+$"
         }
        },
        "required": [
         "bossDefeated"
        ],
        "additionalProperties": false
       }
      ]
     },
     "realmBossZone": {
      "type": "string",
      "pattern": "^[a-z0-9_]+$"
     },
     "next": {
      "type": [
       "integer",
       "null"
      ]
     }
    },
    "required": [
     "realm",
     "node",
     "graph",
     "entry",
     "enterEdge",
     "exitEdge",
     "linkEdge",
     "unlock",
     "realmBossZone",
     "next"
    ],
    "additionalProperties": false
   }
  }
 },
 "required": [
  "schema",
  "id",
  "kind",
  "title",
  "entry",
  "idxMax",
  "edgeIdxMax",
  "aspect",
  "nodes",
  "edges"
 ],
 "additionalProperties": false,
 "allOf": [
  {
   "if": {
    "properties": {
     "kind": {
      "const": "dungeon_level"
     }
    }
   },
   "then": {
    "required": [
     "dungeon",
     "level"
    ],
    "properties": {
     "level": {
      "minimum": 1
     }
    }
   }
  },
  {
   "if": {
    "properties": {
     "kind": {
      "const": "world"
     }
    }
   },
   "then": {
    "required": [
     "realms"
    ]
   },
   "else": {
    "not": {
     "required": [
      "realms"
     ]
    }
   }
  }
 ]
}