{
 "schema": "graph/0.3",
 "id": "demon_castle_5",
 "kind": "dungeon_level",
 "realm": 9,
 "dungeon": "demon_castle",
 "level": 5,
 "title": {
  "zh": "魔王城 第5层",
  "en": "Demon King's Castle - level 5"
 },
 "status": "reference",
 "entry": "stairs_1",
 "idxMax": 8,
 "levels": 5,
 "optional": false,
 "background": {
  "map": "bg_map_demon_castle_5",
  "battle": "bg_battle_r9"
 },
 "edgeIdxMax": 9,
 "aspect": 10.545,
 "nodes": [
  {
   "id": "stairs_1",
   "idx": 0,
   "kind": "stairs_up",
   "x": 0.05,
   "y": 0.5,
   "zone": "throne_hall",
   "title": {
    "zh": "上楼梯",
    "en": "Stairs up"
   }
  },
  {
   "id": "path_1",
   "idx": 1,
   "kind": "waypoint",
   "x": 0.23,
   "y": 0.5,
   "zone": "throne_hall",
   "title": {
    "zh": "小路",
    "en": "Throne Hall path"
   }
  },
  {
   "id": "path_2",
   "idx": 2,
   "kind": "waypoint",
   "x": 0.41,
   "y": 0.05,
   "zone": "throne_hall",
   "title": {
    "zh": "小路",
    "en": "Throne Hall path"
   }
  },
  {
   "id": "inn_1",
   "idx": 3,
   "kind": "inn",
   "x": 0.59,
   "y": 0.05,
   "zone": "throne_hall",
   "title": {
    "zh": "营地客栈",
    "en": "Boss-approach inn"
   },
   "save": true,
   "services": [
    "inn",
    "save",
    "practice",
    "potions"
   ]
  },
  {
   "id": "boss_9",
   "idx": 4,
   "kind": "boss",
   "x": 0.77,
   "y": 0.05,
   "zone": "throne_hall",
   "title": {
    "zh": "魔王",
    "en": "Demon King"
   },
   "boss": "throne_hall",
   "fog": "landmark"
  },
  {
   "id": "path_3",
   "idx": 5,
   "kind": "waypoint",
   "x": 0.41,
   "y": 0.95,
   "zone": "throne_hall",
   "title": {
    "zh": "弯路",
    "en": "Winding path"
   }
  },
  {
   "id": "story_1",
   "idx": 6,
   "kind": "story",
   "x": 0.59,
   "y": 0.95,
   "zone": "throne_hall",
   "title": {
    "zh": "故事点",
    "en": "Story spot"
   }
  },
  {
   "id": "path_4",
   "idx": 7,
   "kind": "waypoint",
   "x": 0.77,
   "y": 0.95,
   "zone": "throne_hall",
   "title": {
    "zh": "弯路",
    "en": "Winding path"
   }
  },
  {
   "id": "inn_2",
   "idx": 8,
   "kind": "inn",
   "x": 0.95,
   "y": 0.5,
   "zone": "throne_hall",
   "title": {
    "zh": "隐藏客栈",
    "en": "Hidden inn"
   },
   "save": true,
   "services": [
    "inn",
    "save",
    "potions"
   ]
  }
 ],
 "edges": [
  {
   "id": "x_stairs_1",
   "from": "stairs_1",
   "kind": "stairs",
   "to": {
    "graph": "demon_castle_4",
    "node": "stairs_2"
   },
   "idx": 0
  },
  {
   "id": "e1",
   "from": "stairs_1",
   "to": "path_1",
   "kind": "path",
   "danger": 2,
   "steps": 1,
   "terrain": "tunnel",
   "idx": 1
  },
  {
   "id": "e2",
   "from": "path_1",
   "to": "path_2",
   "kind": "path",
   "danger": 2,
   "steps": 1,
   "terrain": "tunnel",
   "idx": 2
  },
  {
   "id": "e3",
   "from": "path_2",
   "to": "inn_1",
   "kind": "path",
   "danger": 2,
   "steps": 1,
   "terrain": "tunnel",
   "idx": 3
  },
  {
   "id": "e4",
   "from": "inn_1",
   "to": "boss_9",
   "kind": "path",
   "danger": 0,
   "steps": 1,
   "patrol": true,
   "terrain": "boss_approach",
   "idx": 4
  },
  {
   "id": "e5",
   "from": "path_1",
   "to": "path_3",
   "kind": "path",
   "danger": 1,
   "steps": 1,
   "terrain": "tunnel",
   "idx": 5
  },
  {
   "id": "e6",
   "from": "path_3",
   "to": "story_1",
   "kind": "path",
   "danger": 1,
   "steps": 1,
   "terrain": "tunnel",
   "idx": 6
  },
  {
   "id": "e7",
   "from": "story_1",
   "to": "path_3",
   "kind": "path",
   "danger": 1,
   "steps": 1,
   "terrain": "grass",
   "note": "loop",
   "idx": 7
  },
  {
   "id": "e8",
   "from": "story_1",
   "to": "path_4",
   "kind": "path",
   "danger": 1,
   "steps": 1,
   "terrain": "tunnel",
   "idx": 8
  },
  {
   "id": "e9",
   "from": "path_4",
   "to": "inn_2",
   "kind": "path",
   "danger": 1,
   "steps": 1,
   "terrain": "tunnel",
   "idx": 9
  }
 ],
 "events": [
  {
   "id": "path_1.1",
   "node": "path_1",
   "on": "enter",
   "pick": [
    {
     "weight": 70,
     "outcome": "nothing",
     "once": false,
     "do": []
    },
    {
     "weight": 15,
     "outcome": "story",
     "once": false,
     "do": [
      {
       "dialogue": "ambient"
      }
     ]
    },
    {
     "weight": 15,
     "outcome": "item",
     "cooldown": 4,
     "do": [
      {
       "giveItem": "honey",
       "qty": 1
      }
     ]
    }
   ]
  },
  {
   "id": "path_2.1",
   "node": "path_2",
   "on": "enter",
   "pick": [
    {
     "weight": 70,
     "outcome": "nothing",
     "once": false,
     "do": []
    },
    {
     "weight": 15,
     "outcome": "story",
     "once": false,
     "do": [
      {
       "dialogue": "ambient"
      }
     ]
    },
    {
     "weight": 15,
     "outcome": "item",
     "cooldown": 4,
     "do": [
      {
       "giveItem": "honey",
       "qty": 1
      }
     ]
    }
   ]
  },
  {
   "id": "path_3.1",
   "node": "path_3",
   "on": "enter",
   "pick": [
    {
     "weight": 70,
     "outcome": "nothing",
     "once": false,
     "do": []
    },
    {
     "weight": 15,
     "outcome": "story",
     "once": false,
     "do": [
      {
       "dialogue": "ambient"
      }
     ]
    },
    {
     "weight": 15,
     "outcome": "item",
     "cooldown": 4,
     "do": [
      {
       "giveItem": "honey",
       "qty": 1
      }
     ]
    }
   ]
  },
  {
   "id": "story_1.1",
   "node": "story_1",
   "on": "enter",
   "once": true,
   "outcome": "story",
   "do": [
    {
     "dialogue": "demon_castle_5.story_1"
    }
   ]
  },
  {
   "id": "path_4.1",
   "node": "path_4",
   "on": "enter",
   "pick": [
    {
     "weight": 70,
     "outcome": "nothing",
     "once": false,
     "do": []
    },
    {
     "weight": 15,
     "outcome": "story",
     "once": false,
     "do": [
      {
       "dialogue": "ambient"
      }
     ]
    },
    {
     "weight": 15,
     "outcome": "item",
     "cooldown": 4,
     "do": [
      {
       "giveItem": "honey",
       "qty": 1
      }
     ]
    }
   ]
  }
 ],
 "dialogue": {
  "ambient": [
   {
    "speaker": "xiaolong",
    "en": "Let's keep going!"
   }
  ],
  "demon_castle_5.story_1": [
   {
    "speaker": "xiaolong",
    "en": "(story beat to write)"
   }
  ]
 },
 "npcs": {
  "xiaolong": {
   "name": {
    "zh": "小龙",
    "en": "Xiaolong (Little Dragon, companion)"
   }
  }
 }
}
