{"schema":"graph/0.3","id":"moonlit_crypt_1","kind":"dungeon_level","realm":6,"dungeon":"moonlit_crypt","level":1,"title":{"zh":"月光地穴 第1层","en":"Moonlit Crypt - level 1"},"status":"reference","entry":"stairs_1","idxMax":10,"levels":2,"optional":false,"background":{"map":"bg_map_moonlit_crypt_1","battle":"bg_battle_r6"},"edgeIdxMax":12,"aspect":3.515,"nodes":[{"id":"stairs_1","idx":0,"kind":"stairs_up","x":0.05,"y":0.5,"zone":"moonlit_graveyard","title":{"zh":"地牢口","en":"Dungeon mouth"}},{"id":"path_1","idx":1,"kind":"waypoint","x":0.23,"y":0.5,"zone":"moonlit_graveyard","title":{"zh":"小路","en":"Moonlit Graveyard path"}},{"id":"path_2","idx":2,"kind":"waypoint","x":0.41,"y":0.5,"zone":"moonlit_graveyard","title":{"zh":"小路","en":"Moonlit Graveyard path"}},{"id":"campfire_1","idx":3,"kind":"inn","x":0.59,"y":0.5,"zone":"moonlit_graveyard","title":{"zh":"半路营火","en":"Midpoint campfire inn"},"campfire":true,"save":true,"services":["inn","save","practice","potions"]},{"id":"path_3","idx":4,"kind":"waypoint","x":0.77,"y":0.2,"zone":"moonlit_graveyard","title":{"zh":"小路","en":"Moonlit Graveyard path"}},{"id":"stairs_2","idx":5,"kind":"stairs_down","x":0.95,"y":0.05,"zone":"moonlit_graveyard","title":{"zh":"下楼梯","en":"Stairs down"}},{"id":"npc_1","idx":6,"kind":"npc","x":0.77,"y":0.5,"zone":"moonlit_graveyard","title":{"zh":"旅人","en":"Traveller"}},{"id":"path_4","idx":7,"kind":"fork","x":0.77,"y":0.8,"zone":"moonlit_graveyard","title":{"zh":"弯路","en":"Winding path"}},{"id":"deadend_1","idx":8,"kind":"waypoint","x":0.95,"y":0.35,"zone":"moonlit_graveyard","title":{"zh":"死胡同","en":"Dead end"}},{"id":"treasure_1","idx":9,"kind":"chest","x":0.95,"y":0.65,"zone":"moonlit_graveyard","title":{"zh":"宝藏","en":"Treasure spot"}},{"id":"story_1","idx":10,"kind":"story","x":0.95,"y":0.95,"zone":"moonlit_graveyard","title":{"zh":"故事点","en":"Story spot"}}],"edges":[{"id":"x_stairs_1","from":"stairs_1","kind":"stairs","to":{"graph":"realm_6","node":"portal_1"},"idx":0},{"id":"x_stairs_2","from":"stairs_2","kind":"stairs","to":{"graph":"moonlit_crypt_2","node":"stairs_1"},"idx":1},{"id":"e1","from":"stairs_1","to":"path_1","kind":"path","danger":2,"steps":1,"terrain":"tunnel","idx":2},{"id":"e2","from":"path_1","to":"path_2","kind":"path","danger":2,"steps":1,"terrain":"tunnel","idx":3},{"id":"e3","from":"path_2","to":"campfire_1","kind":"path","danger":2,"steps":1,"terrain":"tunnel","idx":4},{"id":"e4","from":"campfire_1","to":"path_3","kind":"path","danger":2,"steps":1,"terrain":"tunnel","idx":5},{"id":"e5","from":"path_3","to":"stairs_2","kind":"path","danger":2,"steps":1,"terrain":"tunnel","idx":6},{"id":"e6","from":"campfire_1","to":"npc_1","kind":"path","danger":1,"steps":1,"terrain":"tunnel","idx":7},{"id":"e7","from":"campfire_1","to":"path_4","kind":"path","danger":1,"steps":1,"terrain":"tunnel","idx":8},{"id":"e8","from":"path_4","to":"deadend_1","kind":"path","danger":1,"steps":1,"terrain":"tunnel","idx":9},{"id":"e9","from":"deadend_1","to":"path_3","kind":"path","danger":1,"steps":1,"terrain":"grass","note":"loop","idx":10},{"id":"e10","from":"path_4","to":"treasure_1","kind":"path","danger":1,"steps":1,"terrain":"tunnel","idx":11},{"id":"e11","from":"path_4","to":"story_1","kind":"path","danger":1,"steps":1,"terrain":"tunnel","idx":12}],"events":[{"id":"path_1.1","node":"path_1","on":"enter","pick":[{"weight":70,"outcome":"nothing","once":false,"do":[]},{"weight":15,"outcome":"story","once":false,"do":[{"dialogue":"ambient"}]},{"weight":15,"outcome":"item","cooldown":4,"do":[{"giveItem":"honey","qty":1}]}]},{"id":"path_2.1","node":"path_2","on":"enter","pick":[{"weight":70,"outcome":"nothing","once":false,"do":[]},{"weight":15,"outcome":"story","once":false,"do":[{"dialogue":"ambient"}]},{"weight":15,"outcome":"item","cooldown":4,"do":[{"giveItem":"honey","qty":1}]}]},{"id":"path_3.1","node":"path_3","on":"enter","pick":[{"weight":70,"outcome":"nothing","once":false,"do":[]},{"weight":15,"outcome":"story","once":false,"do":[{"dialogue":"ambient"}]},{"weight":15,"outcome":"item","cooldown":4,"do":[{"giveItem":"honey","qty":1}]}]},{"id":"npc_1.1","node":"npc_1","on":"enter","once":true,"outcome":"quest_offer","do":[{"offerQuest":"q6_lost_dog"}]},{"id":"npc_1.2","node":"npc_1","on":"enter","once":true,"outcome":"quest_offer","do":[{"offerQuest":"q6_rattle_bones"}]},{"id":"npc_1.3","node":"npc_1","on":"enter","once":false,"outcome":"story","do":[{"dialogue":"ambient"}]},{"id":"path_4.1","node":"path_4","on":"enter","once":true,"outcome":"story","cond":{"questActive":"q6_lost_dog"},"do":[{"dialogue":"moonlit_crypt_1.path_4.step_q6_lost_dog"}]},{"id":"path_4.2","node":"path_4","on":"enter","pick":[{"weight":70,"outcome":"nothing","once":false,"do":[]},{"weight":15,"outcome":"story","once":false,"do":[{"dialogue":"ambient"}]},{"weight":15,"outcome":"item","cooldown":4,"do":[{"giveItem":"honey","qty":1}]}]},{"id":"deadend_1.1","node":"deadend_1","on":"enter","pick":[{"weight":80,"outcome":"nothing","once":false,"do":[]},{"weight":20,"outcome":"item","cooldown":4,"do":[{"giveItem":"honey","qty":1}]}]},{"id":"treasure_1.1","node":"treasure_1","on":"enter","once":true,"outcome":"treasure","do":[{"openChest":"chest_normal"}]},{"id":"treasure_1.2","node":"treasure_1","on":"enter","once":false,"outcome":"nothing","do":[]},{"id":"story_1.1","node":"story_1","on":"enter","once":true,"outcome":"story","cond":{"questActive":"q6_lost_dog"},"do":[{"dialogue":"moonlit_crypt_1.story_1.step_q6_lost_dog"}]},{"id":"story_1.2","node":"story_1","on":"enter","once":true,"outcome":"story","do":[{"dialogue":"moonlit_crypt_1.story_1"}]}],"dialogue":{"ambient":[{"speaker":"xiaolong","en":"Let's keep going!"}],"moonlit_crypt_1.path_4.step_q6_lost_dog":[{"speaker":"traveller","en":"(quest step for q6_lost_dog: scene from data/dialogue)"}],"moonlit_crypt_1.story_1.step_q6_lost_dog":[{"speaker":"traveller","en":"(quest step for q6_lost_dog: scene from data/dialogue)"}],"moonlit_crypt_1.story_1":[{"speaker":"xiaolong","en":"(story beat to write)"}]},"npcs":{"xiaolong":{"name":{"zh":"小龙","en":"Xiaolong (Little Dragon, companion)"}},"traveller":{"name":{"zh":"旅人","en":"Traveller"}}}}