{
 "schema": "graph/0.3",
 "id": "realm_2",
 "kind": "overworld",
 "realm": 2,
 "dungeon": null,
 "level": 0,
 "title": {
  "zh": "蜂巢森林",
  "en": "Honeycomb Forest"
 },
 "status": "reference",
 "entry": "entry_town",
 "idxMax": 11,
 "background": {
  "map": "bg_map_realm_2",
  "battle": "bg_battle_r2"
 },
 "edgeIdxMax": 12,
 "aspect": 5.273,
 "nodes": [
  {
   "id": "entry_town",
   "idx": 0,
   "kind": "town",
   "x": 0.05,
   "y": 0.5,
   "zone": "forest",
   "title": {
    "zh": "蜂蜜镇",
    "en": "Honey Town"
   },
   "save": true,
   "services": [
    "inn",
    "save",
    "shop"
   ],
   "hub": "village",
   "town": 2,
   "fog": "landmark"
  },
  {
   "id": "path_1",
   "idx": 1,
   "kind": "waypoint",
   "x": 0.1997,
   "y": 0.5,
   "zone": "forest",
   "title": {
    "zh": "小路",
    "en": "Flower Glade path"
   }
  },
  {
   "id": "path_2",
   "idx": 2,
   "kind": "waypoint",
   "x": 0.3503,
   "y": 0.275,
   "zone": "forest",
   "title": {
    "zh": "小路",
    "en": "Flower Glade path"
   }
  },
  {
   "id": "path_3",
   "idx": 3,
   "kind": "waypoint",
   "x": 0.5,
   "y": 0.05,
   "zone": "forest",
   "title": {
    "zh": "小路",
    "en": "Flower Glade path"
   }
  },
  {
   "id": "inn_1",
   "idx": 4,
   "kind": "inn",
   "x": 0.6497,
   "y": 0.275,
   "zone": "forest",
   "title": {
    "zh": "营地客栈",
    "en": "Boss-approach inn"
   },
   "save": true,
   "services": [
    "inn",
    "save",
    "practice",
    "potions"
   ]
  },
  {
   "id": "boss_1",
   "idx": 5,
   "kind": "boss",
   "x": 0.8003,
   "y": 0.275,
   "zone": "forest",
   "title": {
    "zh": "贪吃熊",
    "en": "Greedy Bear"
   },
   "boss": "forest",
   "fog": "landmark"
  },
  {
   "id": "portal_1",
   "idx": 6,
   "kind": "portal",
   "x": 0.95,
   "y": 0.5,
   "zone": "great_hive",
   "title": {
    "zh": "地牢入口",
    "en": "Dungeon door"
   }
  },
  {
   "id": "path_4",
   "idx": 7,
   "kind": "waypoint",
   "x": 0.3503,
   "y": 0.725,
   "zone": "forest",
   "title": {
    "zh": "弯路",
    "en": "Winding path"
   }
  },
  {
   "id": "treasure_1",
   "idx": 8,
   "kind": "chest",
   "x": 0.5,
   "y": 0.5,
   "zone": "forest",
   "title": {
    "zh": "宝藏",
    "en": "Treasure spot"
   }
  },
  {
   "id": "treasure_2",
   "idx": 9,
   "kind": "chest",
   "x": 0.5,
   "y": 0.95,
   "zone": "forest",
   "title": {
    "zh": "宝藏",
    "en": "Treasure spot"
   }
  },
  {
   "id": "path_5",
   "idx": 10,
   "kind": "waypoint",
   "x": 0.6497,
   "y": 0.725,
   "zone": "forest",
   "title": {
    "zh": "弯路",
    "en": "Winding path"
   }
  },
  {
   "id": "treasure_3",
   "idx": 11,
   "kind": "chest",
   "x": 0.8003,
   "y": 0.725,
   "zone": "forest",
   "title": {
    "zh": "宝藏",
    "en": "Treasure spot"
   }
  }
 ],
 "edges": [
  {
   "id": "x_portal_1",
   "from": "portal_1",
   "kind": "portal",
   "to": {
    "graph": "great_hive_1",
    "node": "stairs_1"
   },
   "idx": 0
  },
  {
   "id": "e1",
   "from": "entry_town",
   "to": "path_1",
   "kind": "path",
   "danger": 2,
   "steps": 1,
   "terrain": "grass",
   "idx": 1
  },
  {
   "id": "e2",
   "from": "path_1",
   "to": "path_2",
   "kind": "path",
   "danger": 2,
   "steps": 5,
   "terrain": "grass",
   "idx": 2
  },
  {
   "id": "e3",
   "from": "path_2",
   "to": "path_3",
   "kind": "path",
   "danger": 2,
   "steps": 4,
   "terrain": "grass",
   "idx": 3
  },
  {
   "id": "e4",
   "from": "path_3",
   "to": "inn_1",
   "kind": "path",
   "danger": 2,
   "steps": 1,
   "terrain": "grass",
   "idx": 4
  },
  {
   "id": "e5",
   "from": "inn_1",
   "to": "boss_1",
   "kind": "path",
   "danger": 0,
   "steps": 1,
   "patrol": true,
   "terrain": "boss_approach",
   "idx": 5
  },
  {
   "id": "e6",
   "from": "boss_1",
   "to": "portal_1",
   "kind": "path",
   "danger": 2,
   "steps": 2,
   "terrain": "grass",
   "scripted": {
    "enemies": [
     "royal_guard_bee"
    ],
    "fill": true,
    "once": true,
    "step": 1
   },
   "idx": 6
  },
  {
   "id": "e7",
   "from": "path_1",
   "to": "path_4",
   "kind": "path",
   "danger": 1,
   "steps": 1,
   "terrain": "grass",
   "idx": 7
  },
  {
   "id": "e8",
   "from": "path_4",
   "to": "treasure_1",
   "kind": "path",
   "danger": 1,
   "steps": 1,
   "terrain": "grass",
   "idx": 8
  },
  {
   "id": "e9",
   "from": "path_2",
   "to": "treasure_2",
   "kind": "path",
   "danger": 1,
   "steps": 1,
   "terrain": "grass",
   "idx": 9
  },
  {
   "id": "e10",
   "from": "path_3",
   "to": "path_5",
   "kind": "path",
   "danger": 1,
   "steps": 1,
   "terrain": "grass",
   "idx": 10
  },
  {
   "id": "e11",
   "from": "path_5",
   "to": "treasure_3",
   "kind": "path",
   "danger": 1,
   "steps": 1,
   "terrain": "grass",
   "idx": 11
  },
  {
   "id": "exit_entry_town",
   "from": "entry_town",
   "kind": "exit",
   "to": {
    "graph": "world",
    "node": "realm_2"
   },
   "danger": 0,
   "note": "v3.9.2: leave the realm to the world map from its entry settlement; no battles, always open",
   "idx": 12
  }
 ],
 "events": [
  {
   "id": "path_1.1",
   "node": "path_1",
   "on": "enter",
   "pick": [
    {
     "weight": 70,
     "outcome": "nothing",
     "once": false,
     "do": []
    },
    {
     "weight": 15,
     "outcome": "story",
     "once": false,
     "do": [
      {
       "dialogue": "ambient"
      }
     ]
    },
    {
     "weight": 15,
     "outcome": "item",
     "cooldown": 4,
     "do": [
      {
       "giveItem": "honey",
       "qty": 1
      }
     ]
    }
   ]
  },
  {
   "id": "path_2.1",
   "node": "path_2",
   "on": "enter",
   "pick": [
    {
     "weight": 70,
     "outcome": "nothing",
     "once": false,
     "do": []
    },
    {
     "weight": 15,
     "outcome": "story",
     "once": false,
     "do": [
      {
       "dialogue": "ambient"
      }
     ]
    },
    {
     "weight": 15,
     "outcome": "item",
     "cooldown": 4,
     "do": [
      {
       "giveItem": "honey",
       "qty": 1
      }
     ]
    }
   ]
  },
  {
   "id": "path_3.1",
   "node": "path_3",
   "on": "enter",
   "pick": [
    {
     "weight": 70,
     "outcome": "nothing",
     "once": false,
     "do": []
    },
    {
     "weight": 15,
     "outcome": "story",
     "once": false,
     "do": [
      {
       "dialogue": "ambient"
      }
     ]
    },
    {
     "weight": 15,
     "outcome": "item",
     "cooldown": 4,
     "do": [
      {
       "giveItem": "honey",
       "qty": 1
      }
     ]
    }
   ]
  },
  {
   "id": "path_4.1",
   "node": "path_4",
   "on": "enter",
   "once": true,
   "outcome": "story",
   "cond": {
    "questActive": "q2_lost_panda"
   },
   "do": [
    {
     "dialogue": "realm_2.path_4.step_q2_lost_panda"
    }
   ]
  },
  {
   "id": "path_4.2",
   "node": "path_4",
   "on": "enter",
   "pick": [
    {
     "weight": 80,
     "outcome": "nothing",
     "once": false,
     "do": []
    },
    {
     "weight": 20,
     "outcome": "item",
     "cooldown": 4,
     "do": [
      {
       "giveItem": "honey",
       "qty": 1
      }
     ]
    }
   ]
  },
  {
   "id": "treasure_1.1",
   "node": "treasure_1",
   "on": "enter",
   "once": true,
   "outcome": "treasure",
   "do": [
    {
     "openChest": "chest_normal"
    }
   ]
  },
  {
   "id": "treasure_1.2",
   "node": "treasure_1",
   "on": "enter",
   "once": false,
   "outcome": "nothing",
   "do": []
  },
  {
   "id": "treasure_2.1",
   "node": "treasure_2",
   "on": "enter",
   "once": true,
   "outcome": "story",
   "cond": {
    "questActive": "q2_lost_panda"
   },
   "do": [
    {
     "dialogue": "realm_2.treasure_2.step_q2_lost_panda"
    }
   ]
  },
  {
   "id": "treasure_2.2",
   "node": "treasure_2",
   "on": "enter",
   "once": true,
   "outcome": "treasure",
   "do": [
    {
     "openChest": "chest_normal"
    }
   ]
  },
  {
   "id": "treasure_2.3",
   "node": "treasure_2",
   "on": "enter",
   "once": false,
   "outcome": "nothing",
   "do": []
  },
  {
   "id": "path_5.1",
   "node": "path_5",
   "on": "enter",
   "pick": [
    {
     "weight": 70,
     "outcome": "nothing",
     "once": false,
     "do": []
    },
    {
     "weight": 15,
     "outcome": "story",
     "once": false,
     "do": [
      {
       "dialogue": "ambient"
      }
     ]
    },
    {
     "weight": 15,
     "outcome": "item",
     "cooldown": 4,
     "do": [
      {
       "giveItem": "honey",
       "qty": 1
      }
     ]
    }
   ]
  },
  {
   "id": "treasure_3.1",
   "node": "treasure_3",
   "on": "enter",
   "once": true,
   "outcome": "treasure",
   "do": [
    {
     "openChest": "chest_normal"
    }
   ]
  },
  {
   "id": "treasure_3.2",
   "node": "treasure_3",
   "on": "enter",
   "once": false,
   "outcome": "nothing",
   "do": []
  }
 ],
 "dialogue": {
  "ambient": [
   {
    "speaker": "xiaolong",
    "en": "Let's keep going!"
   }
  ],
  "realm_2.path_4.step_q2_lost_panda": [
   {
    "speaker": "traveller",
    "en": "(quest step for q2_lost_panda: scene from data/dialogue)"
   }
  ],
  "realm_2.treasure_2.step_q2_lost_panda": [
   {
    "speaker": "traveller",
    "en": "(quest step for q2_lost_panda: scene from data/dialogue)"
   }
  ]
 },
 "npcs": {
  "xiaolong": {
   "name": {
    "zh": "小龙",
    "en": "Xiaolong (Little Dragon, companion)"
   }
  },
  "traveller": {
   "name": {
    "zh": "旅人",
    "en": "Traveller"
   }
  }
 }
}
