{"schema":"graph/0.3","id":"shadow_vault_1","kind":"dungeon_level","realm":9,"dungeon":"shadow_vault","level":1,"title":{"zh":"暗影宝库 第1层","en":"Shadow Vault (optional) - level 1"},"status":"reference","entry":"stairs_1","idxMax":20,"levels":2,"optional":true,"background":{"map":"bg_map_shadow_vault_1","battle":"bg_battle_r9"},"edgeIdxMax":21,"aspect":2.636,"nodes":[{"id":"stairs_1","idx":0,"kind":"stairs_up","x":0.05,"y":0.5,"zone":"demon_king_s_gate","title":{"zh":"楼梯","en":"Entrance"}},{"id":"path_1","idx":1,"kind":"fork","x":0.1997,"y":0.5,"zone":"demon_king_s_gate","title":{"zh":"暗厅","en":"Dark hall"}},{"id":"inn_1","idx":2,"kind":"inn","x":0.3503,"y":0.1625,"zone":"demon_king_s_gate","title":{"zh":"地下客栈","en":"Deep inn"},"save":true,"services":["inn","save","potions"]},{"id":"stairs_2","idx":3,"kind":"stairs_down","x":0.3503,"y":0.3875,"zone":"demon_king_s_gate","title":{"zh":"下楼梯","en":"Stairs down"}},{"id":"treasure_1","idx":4,"kind":"chest","x":0.3503,"y":0.6125,"zone":"demon_king_s_gate","title":{"zh":"宝藏","en":"Treasure spot"}},{"id":"path_2","idx":5,"kind":"waypoint","x":0.3503,"y":0.8375,"zone":"demon_king_s_gate","title":{"zh":"弯路","en":"Winding path"}},{"id":"path_3","idx":6,"kind":"waypoint","x":0.5,"y":0.3875,"zone":"demon_king_s_gate","title":{"zh":"弯路","en":"Winding path"}},{"id":"path_4","idx":7,"kind":"fork","x":0.6497,"y":0.275,"zone":"demon_king_s_gate","title":{"zh":"弯路","en":"Winding path"}},{"id":"path_5","idx":8,"kind":"inn","x":0.8003,"y":0.05,"zone":"demon_king_s_gate","title":{"zh":"营火","en":"Campfire inn"},"campfire":true,"save":true,"services":["inn","save","potions"]},{"id":"npc_1","idx":9,"kind":"npc","x":0.95,"y":0.05,"zone":"demon_king_s_gate","title":{"zh":"旅人","en":"Traveller"}},{"id":"path_6","idx":10,"kind":"waypoint","x":0.8003,"y":0.275,"zone":"demon_king_s_gate","title":{"zh":"弯路","en":"Winding path"}},{"id":"treasure_2","idx":11,"kind":"chest","x":0.95,"y":0.275,"zone":"demon_king_s_gate","title":{"zh":"宝藏","en":"Treasure spot"}},{"id":"treasure_3","idx":12,"kind":"chest","x":0.8003,"y":0.5,"zone":"demon_king_s_gate","title":{"zh":"宝藏","en":"Treasure spot"}},{"id":"story_1","idx":13,"kind":"story","x":0.6497,"y":0.5,"zone":"demon_king_s_gate","title":{"zh":"故事点","en":"Story spot"}},{"id":"path_7","idx":14,"kind":"waypoint","x":0.5,"y":0.6125,"zone":"demon_king_s_gate","title":{"zh":"弯路","en":"Winding path"}},{"id":"path_8","idx":15,"kind":"waypoint","x":0.6497,"y":0.725,"zone":"demon_king_s_gate","title":{"zh":"弯路","en":"Winding path"}},{"id":"path_9","idx":16,"kind":"inn","x":0.8003,"y":0.725,"zone":"demon_king_s_gate","title":{"zh":"营火","en":"Campfire inn"},"campfire":true,"save":true,"services":["inn","save","potions"]},{"id":"npc_2","idx":17,"kind":"npc","x":0.95,"y":0.5,"zone":"demon_king_s_gate","title":{"zh":"旅人","en":"Traveller"}},{"id":"path_10","idx":18,"kind":"waypoint","x":0.8003,"y":0.95,"zone":"demon_king_s_gate","title":{"zh":"弯路","en":"Winding path"}},{"id":"treasure_4","idx":19,"kind":"chest","x":0.95,"y":0.725,"zone":"demon_king_s_gate","title":{"zh":"宝藏","en":"Treasure spot"}},{"id":"treasure_5","idx":20,"kind":"chest","x":0.95,"y":0.95,"zone":"demon_king_s_gate","title":{"zh":"宝藏","en":"Treasure spot"}}],"edges":[{"id":"x_stairs_1","from":"stairs_1","kind":"stairs","to":{"graph":"realm_9","node":"portal_2"},"idx":0},{"id":"x_stairs_2","from":"stairs_2","kind":"stairs","to":{"graph":"shadow_vault_2","node":"stairs_1"},"idx":1},{"id":"e1","from":"stairs_1","to":"path_1","kind":"path","danger":2,"steps":1,"terrain":"tunnel","idx":2},{"id":"e2","from":"path_1","to":"inn_1","kind":"path","danger":2,"steps":1,"terrain":"tunnel","idx":3},{"id":"e3","from":"path_1","to":"stairs_2","kind":"path","danger":2,"steps":1,"terrain":"tunnel","idx":4},{"id":"e4","from":"path_1","to":"treasure_1","kind":"path","danger":1,"steps":1,"terrain":"tunnel","idx":5},{"id":"e5","from":"path_1","to":"path_2","kind":"path","danger":1,"steps":2,"terrain":"tunnel","idx":6},{"id":"e6","from":"path_2","to":"path_3","kind":"path","danger":1,"steps":1,"terrain":"tunnel","idx":7},{"id":"e7","from":"path_3","to":"path_4","kind":"path","danger":1,"steps":1,"terrain":"tunnel","idx":8},{"id":"e8","from":"path_4","to":"path_5","kind":"path","danger":1,"steps":1,"terrain":"tunnel","idx":9},{"id":"e9","from":"path_5","to":"npc_1","kind":"path","danger":1,"steps":1,"terrain":"tunnel","idx":10},{"id":"e10","from":"path_4","to":"path_6","kind":"path","danger":1,"steps":1,"terrain":"tunnel","idx":11},{"id":"e11","from":"path_6","to":"treasure_2","kind":"path","danger":1,"steps":1,"terrain":"tunnel","idx":12},{"id":"e12","from":"path_4","to":"treasure_3","kind":"path","danger":1,"steps":1,"terrain":"tunnel","idx":13},{"id":"e13","from":"path_3","to":"story_1","kind":"path","danger":1,"steps":1,"terrain":"tunnel","idx":14},{"id":"e14","from":"treasure_1","to":"path_7","kind":"path","danger":1,"steps":2,"terrain":"tunnel","idx":15},{"id":"e15","from":"path_7","to":"path_8","kind":"path","danger":1,"steps":1,"terrain":"tunnel","idx":16},{"id":"e16","from":"path_8","to":"path_9","kind":"path","danger":1,"steps":1,"terrain":"tunnel","idx":17},{"id":"e17","from":"path_9","to":"npc_2","kind":"path","danger":1,"steps":1,"terrain":"tunnel","idx":18},{"id":"e18","from":"story_1","to":"path_10","kind":"path","danger":1,"steps":1,"terrain":"tunnel","idx":19},{"id":"e19","from":"path_10","to":"treasure_4","kind":"path","danger":1,"steps":1,"terrain":"tunnel","idx":20},{"id":"e20","from":"path_5","to":"treasure_5","kind":"path","danger":1,"steps":1,"terrain":"tunnel","idx":21}],"events":[{"id":"path_1.1","node":"path_1","on":"enter","pick":[{"weight":70,"outcome":"nothing","once":false,"do":[]},{"weight":15,"outcome":"story","once":false,"do":[{"dialogue":"ambient"}]},{"weight":15,"outcome":"item","cooldown":4,"do":[{"giveItem":"honey","qty":1}]}]},{"id":"treasure_1.1","node":"treasure_1","on":"enter","once":true,"outcome":"treasure","do":[{"openChest":"chest_normal"}]},{"id":"treasure_1.2","node":"treasure_1","on":"enter","once":false,"outcome":"nothing","do":[]},{"id":"path_2.1","node":"path_2","on":"enter","pick":[{"weight":70,"outcome":"nothing","once":false,"do":[]},{"weight":15,"outcome":"story","once":false,"do":[{"dialogue":"ambient"}]},{"weight":15,"outcome":"item","cooldown":4,"do":[{"giveItem":"honey","qty":1}]}]},{"id":"path_3.1","node":"path_3","on":"enter","pick":[{"weight":70,"outcome":"nothing","once":false,"do":[]},{"weight":15,"outcome":"story","once":false,"do":[{"dialogue":"ambient"}]},{"weight":15,"outcome":"item","cooldown":4,"do":[{"giveItem":"honey","qty":1}]}]},{"id":"path_4.1","node":"path_4","on":"enter","pick":[{"weight":70,"outcome":"nothing","once":false,"do":[]},{"weight":15,"outcome":"story","once":false,"do":[{"dialogue":"ambient"}]},{"weight":15,"outcome":"item","cooldown":4,"do":[{"giveItem":"honey","qty":1}]}]},{"id":"npc_1.1","node":"npc_1","on":"enter","once":false,"outcome":"story","do":[{"dialogue":"shadow_vault_1.npc_1.banter"}]},{"id":"path_6.1","node":"path_6","on":"enter","pick":[{"weight":70,"outcome":"nothing","once":false,"do":[]},{"weight":15,"outcome":"story","once":false,"do":[{"dialogue":"ambient"}]},{"weight":15,"outcome":"item","cooldown":4,"do":[{"giveItem":"honey","qty":1}]}]},{"id":"treasure_2.1","node":"treasure_2","on":"enter","once":true,"outcome":"treasure","do":[{"openChest":"chest_normal"}]},{"id":"treasure_2.2","node":"treasure_2","on":"enter","once":false,"outcome":"nothing","do":[]},{"id":"treasure_3.1","node":"treasure_3","on":"enter","once":true,"outcome":"treasure","do":[{"openChest":"chest_normal"}]},{"id":"treasure_3.2","node":"treasure_3","on":"enter","once":false,"outcome":"nothing","do":[]},{"id":"story_1.1","node":"story_1","on":"enter","once":true,"outcome":"story","do":[{"dialogue":"shadow_vault_1.story_1"}]},{"id":"path_7.1","node":"path_7","on":"enter","pick":[{"weight":70,"outcome":"nothing","once":false,"do":[]},{"weight":15,"outcome":"story","once":false,"do":[{"dialogue":"ambient"}]},{"weight":15,"outcome":"item","cooldown":4,"do":[{"giveItem":"honey","qty":1}]}]},{"id":"path_8.1","node":"path_8","on":"enter","pick":[{"weight":70,"outcome":"nothing","once":false,"do":[]},{"weight":15,"outcome":"story","once":false,"do":[{"dialogue":"ambient"}]},{"weight":15,"outcome":"item","cooldown":4,"do":[{"giveItem":"honey","qty":1}]}]},{"id":"npc_2.1","node":"npc_2","on":"enter","once":false,"outcome":"story","do":[{"dialogue":"shadow_vault_1.npc_2.banter"}]},{"id":"path_10.1","node":"path_10","on":"enter","pick":[{"weight":70,"outcome":"nothing","once":false,"do":[]},{"weight":15,"outcome":"story","once":false,"do":[{"dialogue":"ambient"}]},{"weight":15,"outcome":"item","cooldown":4,"do":[{"giveItem":"honey","qty":1}]}]},{"id":"treasure_4.1","node":"treasure_4","on":"enter","once":true,"outcome":"treasure","do":[{"openChest":"chest_normal"}]},{"id":"treasure_4.2","node":"treasure_4","on":"enter","once":false,"outcome":"nothing","do":[]},{"id":"treasure_5.1","node":"treasure_5","on":"enter","once":true,"outcome":"treasure","do":[{"openChest":"chest_normal"}]},{"id":"treasure_5.2","node":"treasure_5","on":"enter","once":false,"outcome":"nothing","do":[]}],"dialogue":{"ambient":[{"speaker":"xiaolong","en":"Let's keep going!"}],"shadow_vault_1.npc_1.banter":[{"speaker":"traveller","en":"(one-line ambient banter to write)"}],"shadow_vault_1.story_1":[{"speaker":"xiaolong","en":"(story beat to write)"}],"shadow_vault_1.npc_2.banter":[{"speaker":"traveller","en":"(one-line ambient banter to write)"}]},"npcs":{"xiaolong":{"name":{"zh":"小龙","en":"Xiaolong (Little Dragon, companion)"}},"traveller":{"name":{"zh":"旅人","en":"Traveller"}}}}